Name,Slug,Description,Image
Hurghada,hurghada,Beautiful coastal city on the Red Sea,https://via.placeholder.com/800x600
Sharm El Sheikh,sharm-el-sheikh,Popular resort town on the Red Sea,https://via.placeholder.com/800x600
Cairo,cairo,The capital city with pyramids and ancient history,https://via.placeholder.com/800x600
Luxor,luxor,Ancient Egyptian city with incredible temples,https://via.placeholder.com/800x600
Dahab,dahab,Laid-back coastal town perfect for diving,https://via.placeholder.com/800x600
El Gouna,el-gouna,Modern resort town with beautiful lagoons,https://via.placeholder.com/800x600
Sinai Peninsula,sinai-peninsula,Mountainous peninsula with stunning landscapes,https://via.placeholder.com/800x600
Marsa Alam,marsa-alam,Pristine beaches and diving spots,https://via.placeholder.com/800x600 